product_id,product_name,price
o22688,doormat peace on earth blue,9.59421052631579
o22689,doormat merry christmas red,9.99453488372093
o22690,doormat home sweet home blue,8.255686274509804
o22691,doormat welcome sunrise,9.046363636363637
o22692,doormat welcome to our home,9.4531221719457
o22693,grow a flytrap or sunflower in tin,1.5105555555555557
o22694,wicker star,2.4862745098039216
o22695,wicker wreath small,1.8826229508196721
o22696,wicker wreath large,2.387692307692308
o22697,green regency teacup and saucer,3.807803992740472
o22698,pink regency teacup and saucer,3.6951589242053786
o22699,roses regency teacup and saucer,3.6243247863247863
o22700,black and white dog bowl,2.261923076923077
o22701,pink dog bowl,2.677454545454545
o22702,black and white cat bowl,2.352
o22703,pink cat bowl,1.7610526315789472
o22704,wrap red apples,0.41802469135802467
o22705,wrap green pears,0.42000000000000004
o22706,wrap cowboys,0.4177142857142857
o22707,wrap monster fun,0.42
o22708,wrap dolly girl,0.42
o22709,wrap wedding day,0.4168421052631579
o22710,wrap i love london,0.414
o22711,wrap circus parade,0.42
o22712,card dolly girl,0.5382278481012658
o22713,card i love london,0.5435106382978723
o22714,card birthday cowboy,0.5215887850467289
o22715,card wedding day,0.5170149253731343
o22716,card circus parade,0.5137301587301588
o22717,card dog and ball,0.5281159420289855
o22718,card cat and tree,0.5586516853932584
o22719,gumball monochrome coat rack,2.0108196721311473
o22720,set of 3 cake tins pantry design,5.81278600269179
o22721,set of 3 cake tins sketchbook,5.566595744680851
o22722,set of 6 spice tins pantry design,4.655981735159817
o22723,set of 6 herb tins sketchbook,4.323907284768212
o22725,alarm clock bakelike chocolate,4.7333884297520665
o22726,alarm clock bakelike green,4.58750495049505
o22727,alarm clock bakelike red,4.270833333333333
o22728,alarm clock bakelike pink,4.691362530413626
o22729,alarm clock bakelike orange,4.521147540983607
o22730,alarm clock bakelike ivory,4.301833910034603
o22731,3d christmas stamps stickers,1.5281578947368422
o22732,3d vintage christmas stickers,1.5172631578947366
o22733,3d traditional christmas stickers,1.5204950495049505
o22734,set of 6 ribbons vintage christmas,3.4956118143459918
o22735,ribbon reel socks and mittens,2.445921052631579
o22736,ribbon reel making snowmen,2.3568067226890754
o22737,ribbon reel christmas present,2.4146
o22738,ribbon reel snowy village,2.299225806451613
o22739,ribbon reel christmas sock bauble,2.323167701863354
o22740,polkadot pen,1.1500000000000001
o22741,funky diva pen,1.0920192307692307
o22742,make your own playtime card kit,3.308367346938776
o22743,make your own flowerpower card kit,3.748518518518519
o22744,make your own monsoon card kit,3.0474117647058825
o22745,poppys playhouse bedroom,2.552521739130435
o22746,poppys playhouse livingroom,2.5284375
o22747,poppys playhouse bathroom,2.45425
o22748,poppys playhouse kitchen,2.4897520661157024
o22749,feltcraft princess charlotte doll,4.1087037037037035
o22750,feltcraft princess lola doll,4.023142857142857
o22751,feltcraft princess olivia doll,4.358551724137931
o22752,set 7 babushka nesting boxes,9.473315789473684
o22753,small yellow babushka notebook,0.9580341880341879
o22754,small red babushka notebook,0.9946153846153846
o22755,small purple babushka notebook,0.9836363636363635
o22756,large yellow babushka notebook,1.5296774193548388
o22757,large red babushka notebook,1.6048235294117648
o22758,large purple babushka notebook,1.492336448598131
o22759,set of 3 notebooks in parcel,2.016363636363636
o22760,"tray, breakfast in bed",15.0184
o22761,chest 7 drawer ma campagne,24.55
o22762,cupboard 3 drawer ma campagne,17.5548
o22763,key cabinet ma campagne,10.971428571428572
o22764,"rustic wooden cabinet, glass doors",24.95
o22765,newspaper stand,29.79
o22766,photo frame cornice,3.2313432835820897
o22767,triple photo frame cornice,10.45
o22768,family photo frame cornice,10.93985185185185
o22769,chalkboard kitchen organiser,33.64
o22770,mirror cornice,16.204705882352943
o22771,clear drawer knob acrylic edwardian,1.5273127753303963
o22772,pink drawer knob acrylic edwardian,1.581
o22773,green drawer knob acrylic edwardian,1.589591836734694
o22774,red drawer knob acrylic edwardian,1.5609230769230769
o22775,purple drawerknob acrylic edwardian,1.6647142857142858
o22776,sweetheart cakestand 3 tier,11.16797833935018
o22777,glass cloche large,10.633181818181818
o22778,glass cloche small,4.669090909090909
o22779,wooden owls light garland,4.175074626865672
o22780,light garland butterfiles pink,4.19975
o22781,gumball magazine rack,9.81188976377953
o22782,set 3 wicker storage baskets,19.242682926829268
o22783,set 3 wicker oval baskets w lids,16.072142857142858
o22784,lantern cream gazebo,5.56283950617284
o22785,squarecushion cover pink union jack,7.337948717948718
o22786,cushion cover pink union jack,6.9428
o22788,brocante coat rack,12.27030303030303
o22789,t-light holder sweetheart hanging,2.1481081081081084
o22791,t-light glass fluted antique,1.4948823529411766
o22792,fluted antique candle holder,1.1654918032786885
o22794,sweetheart wire magazine rack,8.918952380952382
o22795,sweetheart recipe book stand,8.127024390243902
o22796,photo frame 3 classic hanging,10.302105263157893
o22797,chest of drawers gingham heart,17.510909090909088
o22798,antique glass dressing table pot,3.681972789115646
o22799,sweetheart wire fruit bowl,8.60530612244898
o22800,antique tall swirlglass trinket pot,4.800258620689656
o22801,antique glass pedestal bowl,4.7026666666666666
o22802,faux fur chocolate throw,18.715925925925927
o22803,ivory embroidered quilt,37.593636363636364
o22804,candleholder pink hanging heart,3.12444
o22805,blue drawer knob acrylic edwardian,1.669032258064516
o22806,set of 6 t-lights wedding cake,3.469130434782609
o22807,set of 6 t-lights toadstools,3.887722772277228
o22808,set of 6 t-lights easter chicks,3.6885
o22809,set of 6 t-lights santa,3.4602608695652175
o22810,set of 6 t-lights snowmen,3.3915853658536586
o22811,set of 6 t-lights cacti,3.8464912280701755
o22812,pack 3 boxes christmas pannetone,2.8806451612903223
o22813,pack 3 boxes bird pannetone,2.5115533980582523
o22814,card party games,0.5036607142857142
o22815,card psychedelic apples,0.48263565891472865
o22816,card motorbike santa,0.4632835820895522
o22817,card suki birthday,0.47034013605442176
o22818,card christmas village,0.4632478632478632
o22819,"birthday card, retro spot",0.46612676056338026
o22820,gift bag birthday,0.5848717948717949
o22821,gift bag psychedelic apples,0.7212307692307692
o22822,cream wall planter heart shaped,6.319375
o22823,chest natural wood 20 drawers,102.85714285714286
o22824,3 tier sweetheart garden shelf,35.540909090909096
o22825,decorative plant pot with frieze,7.95
o22826,love seat antique white metal,130.26315789473685
o22827,rustic  seventeen drawer sideboard,159.54545454545453
o22828,regency mirror with shutters,155.0
o22829,sweetheart wire wall tidy,10.761129032258063
o22830,utilty cabinet with hooks,21.3
o22831,white brocante soap dish,3.3263934426229507
o22832,brocante shelf with hooks,12.25235294117647
o22833,hall cabinet with 3 drawers,49.95
o22834,hand warmer babushka design,2.2866153846153847
o22835,hot water bottle i am so poorly,5.897185628742515
o22837,hot water bottle babushka,5.632376237623762
o22838,3 tier cake tin red and cream,17.348399999999998
o22839,3 tier cake tin green and cream,17.848666666666666
o22840,round cake tin vintage red,8.042537313432836
o22841,round cake tin vintage green,8.310535714285715
o22842,biscuit tin vintage red,7.212954545454545
o22843,biscuit tin vintage green,6.973552631578947
o22844,vintage cream dog food container,10.835906976744186
o22845,vintage cream cat food container,7.939932432432432
o22846,bread bin diner style red,17.594887218045113
o22847,bread bin diner style ivory,17.546530612244897
o22848,bread bin diner style pink,17.824153846153845
o22849,bread bin diner style mint,17.28014492753623
o22851,set 20 napkins fairy cakes design,1.0010055865921788
o22852,dog bowl vintage cream,4.587123287671233
o22853,cat bowl vintage cream,3.7378571428571425
o22854,cream sweetheart egg holder,5.4405
o22855,fine wicker heart,1.5236134453781514
o22856,assorted easter decorations  bells,2.114117647058823
o22857,assorted easter gift tags,1.3837837837837836
o22858,easter tin keepsake,1.9056521739130436
o22859,easter tin bunny bouquet,1.856923076923077
o22860,easter tin chicks pink daisy,1.9978787878787876
o22861,easter tin chicks in garden,2.0404761904761903
o22862,love heart napkin box,5.341578947368421
o22863,soap dish brocante,3.3145283018867926
o22865,hand warmer owl design,2.2720249221183804
o22866,hand warmer scotty dog design,2.3293288590604027
o22867,hand warmer bird design,2.4169064748201436
o22868,number tile cottage garden 0,3.3125
o22869,number tile cottage garden 1,3.2804347826086957
o22870,number tile cottage garden 2,3.4077777777777776
o22871,number tile cottage garden 3,3.04
o22872,number tile cottage garden 4,3.04
o22873,number tile cottage garden 5,3.123846153846154
o22874,number tile cottage garden 6,3.046666666666667
o22875,number tile cottage garden 7,2.9277777777777776
o22876,number tile cottage garden 8,2.8716666666666666
o22877,number tile cottage garden 9,2.822
o22878,number tile cottage garden no,3.318
o22879,number tile vintage font 0,3.4840000000000004
o22880,number tile vintage font 1,3.346842105263158
o22881,number tile vintage font 2,3.155294117647059
o22882,number tile vintage font 3,3.17
o22883,number tile vintage font 4,3.1981818181818182
o22884,number tile vintage font 5,3.1965
o22885,number tile vintage font 6,2.9828571428571427
o22886,number tile vintage font 7,3.12125
o22887,number tile vintage font 8,3.016
o22888,number tile vintage font 9,3.0523529411764705
o22889,number tile vintage font no,3.3594999999999997
o22890,novelty biscuits cake stand 3 tier,11.495697674418604
o22891,tea for one polkadot,5.741041666666667
o22892,set of salt and pepper toadstools,1.245809523809524
o22893,mini cake stand t-light holder,0.6175757575757576
o22894,tablecloth red apples design,9.683770491803278
o22895,set of 2 tea towels apple and pears,3.577272727272727
o22896,peg bag apples design,3.19437908496732
o22897,oven mitt apples design,1.7681481481481482
o22898,childrens apron apples design,2.511428571428571
o22899,childrens apron dolly girl,2.371446540880503
o22900,set 2 tea towels i love london,3.7535915492957748
o22902,tote bag i love london,2.743733333333333
o22903,calendar family favourites,2.958
o22904,calendar paper cut design,3.3437984496124034
o22905,calendar in season design,2.714905660377359
o22906,12 message cards with envelopes,2.1004580152671752
o22907,pack of 20 napkins pantry design,0.9814912280701753
o22908,pack of 20 napkins red apples,0.9502941176470587
o22909,set of 20 vintage christmas napkins,0.9948664688427299
o22910,paper chain kit vintage christmas,3.347985948477752
o22911,paper chain kit london,3.0951851851851853
o22912,yellow coat rack paris fashion,5.28
o22913,red coat rack paris fashion,5.593461538461539
o22914,blue coat rack paris fashion,5.5183544303797465
o22915,assorted bottle top  magnets,1.0403030303030303
o22916,herb marker thyme,0.8880530973451327
o22917,herb marker rosemary,0.8466153846153847
o22918,herb marker parsley,0.8499186991869919
o22919,herb marker mint,0.8500806451612903
o22920,herb marker basil,0.8447517730496454
o22921,herb marker chives,0.825
o22922,fridge magnets us diner assorted,1.9389473684210525
o22923,fridge magnets les enfants assorted,1.1343589743589741
o22924,fridge magnets la vie en rose,1.2764285714285715
o22925,blue giant garden thermometer,6.573775510204082
o22926,ivory giant garden thermometer,6.15070796460177
o22927,green giant garden thermometer,6.5025
o22928,yellow giant garden thermometer,7.384838709677419
o22929,school desk and chair,63.43333333333333
o22930,baking mould heart milk chocolate,3.075357142857143
o22931,baking mould heart white chocolate,2.7878260869565215
o22932,baking mould toffee cup chocolate,2.6883333333333335
o22933,baking mould easter egg milk choc,3.5492647058823534
o22934,baking mould easter egg white choc,3.10448275862069
o22935,baking mould rose milk chocolate,3.594375
o22936,baking mould rose white chocolate,4.09
o22937,baking mould chocolate cupcakes,2.9006410256410255
o22938,cupcake lace paper set 6,2.101208791208791
o22939,apron apple delight,5.934571428571429
o22940,feltcraft christmas fairy,4.540119047619048
o22941,christmas lights 10 reindeer,9.787914110429448
o22942,christmas lights 10 santas,8.275641025641026
o22943,christmas lights 10 vintage baubles,6.239805825242719
o22944,christmas metal postcard with bells,1.2014285714285713
o22945,christmas metal tags assorted,2.2324358974358973
o22946,wooden advent calendar cream,17.75847222222222
o22947,wooden advent calendar red,13.606470588235295
o22948,metal decoration naughty children,1.8476470588235292
o22949,36 doilies dolly girl,1.7244444444444442
o22950,36 doilies vintage christmas,1.6653333333333333
o22951,60 cake cases dolly girl design,0.6685232067510548
o22952,60 cake cases vintage christmas,0.7562537764350454
o22953,birthday party cordon barrier tape,1.2757777777777777
o22954,hen party cordon barrier tape,1.2312
o22955,36 foil star cake cases,2.345555555555556
o22956,36 foil heart cake cases,2.192385321100917
o22957,set 3 paper vintage chick paper egg,3.1655752212389383
o22959,wrap christmas village,0.41315068493150686
o22960,jam making set with jars,5.004922600619195
o22961,jam making set printed,1.9074157303370785
o22962,jam jar with pink lid,1.022471264367816
o22963,jam jar with green lid,1.0641935483870968
o22964,3 piece spaceboy cookie cutter set,2.5017910447761196
o22965,3 traditional biscuit cutters  set,2.2468000000000004
o22966,gingerbread man cookie cutter,1.4697910447761193
o22967,set 3 song bird paper eggs assorted,2.970246913580247
o22968,rose cottage keepsake box,11.795106382978723
o22969,homemade jam scented candles,1.767032640949555
o22970,london bus coffee mug,2.6985207100591713
o22971,queens guard coffee mug,2.829863945578231
o22972,childrens spaceboy mug,2.04
o22973,childrens circus parade mug,1.9329999999999998
o22974,childrens dolly girl mug,1.9479245283018867
o22975,spaceboy childrens egg cup,1.541530612244898
o22976,circus parade childrens egg cup,1.4133333333333333
o22977,dolly girl childrens egg cup,1.511038961038961
o22978,pantry rolling pin,4.467272727272727
o22979,pantry washing up brush,1.7525252525252526
o22980,pantry scrubbing brush,1.8377142857142854
o22981,pantry apple corer,1.8699999999999999
o22982,pantry pastry brush,1.6077391304347826
o22983,card billboard font,0.521826923076923
o22984,card gingham rose,0.47674157303370784
o22985,wrap billboard fonts design,0.41703703703703704
o22986,wrap gingham rose,0.42
o22987,wrap summer rose design,0.42
o22988,soldiers egg cup,1.4950454545454543
o22989,set 2 pantry design tea towels,3.5971345029239767
o22990,cotton apron pantry design,5.46032967032967
o22991,giraffe wooden ruler,2.3624137931034483
o22992,revolver wooden ruler,2.2842690058479533
o22993,set of 4 pantry jelly moulds,1.5024865831842575
o22994,travel card wallet retrospot,0.520090909090909
o22995,travel card wallet suki,0.5415862068965517
o22996,travel card wallet vintage ticket,0.5210360360360361
o22997,travel card wallet union jack,0.48099173553719005
o22998,travel card wallet keep calm,0.5017647058823529
o22999,travel card wallet vintage leaf,0.48008928571428566
o23000,travel card wallet transport,0.5161379310344828
o23001,travel card wallet dotcomgiftshop,0.0
o23002,travel card wallet skulls,0.5166981132075471
o23003,travel card wallet vintage rose,0.41759999999999997
o23004,travel card wallet pantry,0.590188679245283
o23005,travel card wallet i love london,0.4975396825396825
o23006,travel card wallet flower meadow,0.5251612903225806
o23007,spaceboy baby gift set,15.893092783505153
o23008,dolly girl baby gift set,16.114571428571427
o23009,i love london baby gift set,15.44758620689655
o23010,circus parade baby gift set,16.463272727272727
o23012,glass apothecary bottle perfume,4.663880597014925
o23013,glass apothecary bottle tonic,4.668918918918919
o23014,glass apothecary bottle elixir,4.7129906542056075
o23015,cordial glass jug,8.25
o23016,glass twist bon bon jar,8.917499999999999
o23017,apothecary measuring jar,13.197142857142856
o23018,large apothecary measuring jar,12.350000000000001
o23019,small apothecary measuring jar,8.003846153846153
o23020,glass  songbird storage jar,12.663255813953487
o23021,glass bonne jam jar,4.445714285714286
o23022,small bonne jam jar  t-light holder,2.0536363636363637
o23023,ridged bonne jam jar t-light holder,1.7593333333333334
o23024,large bonne jam jar  t-light holder,2.73
o23025,drawer knob vintage glass ball,2.231851851851852
o23026,drawer knob vintage glass star,2.3271875
o23027,drawer knob vintage glass hexagon,2.353333333333333
o23028,drawer knob crackle glaze blue,2.0852542372881357
o23029,drawer knob crackle glaze green,1.7675609756097561
o23031,drawer knob crackle glaze pink,1.8038095238095235
o23032,drawer knob crackle glaze ivory,1.7669421487603305
o23033,drawer knob ceramic red,1.896060606060606
o23034,drawer knob ceramic black,1.5799999999999998
o23035,drawer knob ceramic ivory,1.6456043956043955
o23036,t-light holder silver petit four,1.5525
o23037,candle holder silver madeline,2.1633333333333336
o23038,t-light holder silver saucer,1.23
o23039,t-light holder silver heart handle,2.2623076923076924
o23040,paper lantern 9 point snow star,5.961666666666667
o23041,paper lantern 9 point snow star,4.593571428571429
o23042,paper lantern 7 point snow star,8.863333333333333
o23043,paper lantern 9 point holly star l,6.25
o23044,paper lantern 9 point holly star s,4.393529411764706
o23045,paper lantern 5 point star moon,4.7869230769230775
o23046,paper lantern 9 point deluxe star,6.65
o23047,paper lantern 5 point sequin star,5.75
o23048,set of 10 lanterns fairy light star,4.731052631578947
o23049,recycled acapulco mat red,9.035473684210526
o23050,recycled acapulco mat green,9.018807339449541
o23051,recycled acapulco mat blue,9.91711111111111
o23052,recycled acapulco mat turquoise,9.751438848920863
o23053,recycled acapulco mat pink,9.635555555555555
o23054,recycled acapulco mat lavender,9.138787878787879
o23055,ivory chandelier t-light holder,5.244230769230769
o23056,flowers chandelier t-light holder,5.84
o23057,beaded chandelier t-light holder,4.772285714285714
o23058,christmas hanging snowflake,1.3871428571428572
o23059,thrown away-rusty,0.0
o23060,heart beaded trellis decoration,2.307777777777778
o23061,vintage embossed heart,1.4315
o23064,cinderella chandelier,41.8175
o23065,large deco jewellery stand,12.962156862745099
o23066,small deco jewellery stand,9.088
o23067,hanging engraved metal heart,4.246279069767442
o23068,aluminium stamped heart,2.570138888888889
o23069,edwardian photo frame,6.25
o23070,edwardian heart photo frame,5.23
o23071,marie antoinette trinket box gold,11.353125
o23072,marie antoinette trinket box silver,13.089333333333334
o23073,georgian trinket box,12.415625
o23074,embossed heart trinket box,2.6475
o23075,parlour ceramic wall hook,4.140476190476191
o23076,ice cream sundae lip gloss,1.3875172413793104
o23077,doughnut lip gloss,1.3396774193548386
o23078,ice cream pen lip gloss,1.4220000000000002
o23079,toadstool bedside light,8.939062499999999
o23080,red metal box top secret,9.44703125
o23081,green metal box army supplies,9.266851851851852
o23082,set 6 paper table lantern hearts,4.080503144654088
o23083,set 6 paper table lantern stars,4.244916666666667
o23084,rabbit night light,2.359468690702087
o23085,antique silver bauble lamp,10.851111111111111
o23086,zinc  star t-light holder,1.5807142857142857
o23087,zinc  heart t-light holder,1.5744444444444445
o23088,zinc heart flower t-light holder,1.59390243902439
o23089,glass bon bon jar,2.41
o23090,vintage glass t-light holder,0.9825925925925927
o23091,zinc herb garden container,6.6222
o23092,large antique white photo frame,7.9838571428571425
o23093,small parisienne heart photo frame,2.6985074626865675
o23094,le grand tray chic set,12.84611111111111
o23096,petit tray chic,2.014179104477612
o23099,french carriage lantern,6.780810810810811
o23100,silver bells table decoration,1.4483333333333335
o23101,silver stars table decoration,1.0044036697247705
o23102,silver hearts table decoration,0.9726250000000001
o23103,jingle bell heart decoration,1.8599521531100476
o23104,ivory cafe hanging lamp,13.537272727272727
o23106,zinc hearts plant pot holder,2.822
o23107,white hearts wire plant pot holder,3.370645161290323
o23108,set of 10 led dolly lights,6.299789473684211
o23109,pack of six led tea lights,3.2568243243243242
o23110,parisienne key cabinet,6.467777777777778
o23111,parisienne sewing box,13.286760563380282
o23112,parisienne curio cabinet,9.07580357142857
o23113,pantry chopping board,6.158
o23114,vintage leaf chopping board,5.784285714285714
o23115,red apples chopping board,6.011818181818182
o23116,vegetable garden chopping board,6.011818181818182
o23117,poppy fields chopping board,5.457826086956522
o23118,parisienne jewellery drawer,8.242846715328467
o23119,pack of 6 large fruit straws,0.7598648648648648
o23120,pack of 6 small fruit straws,0.45314814814814813
o23121,pack of 6 cocktail parasol straws,0.5205357142857142
o23122,party charms 50 pieces,1.0631944444444443
o23123,cocktail swords 50 pieces,1.0372222222222223
o23124,18pc wooden cutlery set disposable,1.628125
o23125,6pc wood plate set disposable,2.147
o23126,feltcraft girl amelie kit,5.368214285714286
o23127,feltcraft girl nicole kit,5.209907407407408
o23128,feltcraft boy jean-paul kit,5.453544303797468
o23129,heart shaped holly wreath,4.445714285714286
o23130,mistletoe heart wreath green,4.4542222222222225
o23131,mistletoe heart wreath cream,4.225272727272728
o23132,small ivory heart wall organiser,6.125
o23133,large ivory heart wall organiser,9.384302325581395
o23134,large zinc heart wall organiser,8.30391304347826
o23135,small zinc heart wall organiser,5.430000000000001
o23136,ivory wire sweetheart letter tray,4.162222222222222
o23137,zinc wire sweetheart letter tray,3.4375
o23138,single wire hook ivory heart,1.522888888888889
o23139,single wire hook pink heart,1.9583333333333333
o23140,triple wire hook ivory heart,4.621764705882353
o23141,triple wire hook pink heart,3.81
o23142,ivory wire kitchen organiser,10.758636363636363
o23143,zinc wire kitchen organiser,13.266
o23144,zinc t-light holder stars small,0.9662585034013604
o23145,zinc t-light holder star large,1.0996341463414634
o23146,triple hook antique ivory rose,3.511538461538462
o23147,single antique rose hook ivory,1.4934645669291338
o23148,miniature antique rose hook ivory,0.9157894736842105
o23149,antique ivory wire bowl small,2.764444444444445
o23150,ivory sweetheart soap dish,2.737
o23151,zinc sweetheart soap dish,2.287692307692308
o23152,ivory sweetheart wire letter rack,3.9244578313253013
o23153,zinc sweetheart wire letter rack,4.0865625
o23154,set of 4 jam jar magnets,2.157246376811594
o23155,knickerbockerglory magnet assorted,1.2831884057971013
o23156,set of 5 mini grocery magnets,2.305408163265306
o23157,set of 6 nativity magnets,2.343111111111111
o23158,set of 5 lucky cat magnets,2.5832258064516127
o23159,set of 5 pancake day magnets,2.397102803738318
o23160,regency tea spoon,1.412857142857143
o23161,regency cake fork,1.5596153846153844
o23162,regency tea strainer,4.5488888888888885
o23163,regency sugar tongs,3.289514563106796
o23164,regency cake slice,5.463414634146342
o23165,large ceramic top storage jar,1.961645569620253
o23166,medium ceramic top storage jar,1.4536641221374047
o23167,small ceramic top storage jar,1.016990291262136
o23168,classic cafe sugar dispenser,1.736
o23169,classic glass cookie jar,4.580264550264551
o23170,regency tea plate roses,2.0652558139534882
o23171,regency tea plate green,2.1292
o23172,regency tea plate pink,2.0116666666666667
o23173,regency teapot roses,10.886872246696035
o23174,regency sugar bowl green,4.754268292682927
o23175,regency milk jug pink,3.8323353293413174
o23176,abc treasure book box,2.554765625
o23177,treasure island book box,2.6652517985611515
o23178,jam clock magnet,3.074705882352941
o23179,clock magnet mums kitchen,3.633448275862069
o23180,mums kitchen clock,6.075000000000001
o23181,bull dog bottle top wall clock,9.324358974358974
o23182,toilet sign occupied or vacant,1.5129186602870812
o23183,mothers kitchen spoon rest,4.92
o23184,bull dog bottle opener,6.325827338129496
o23185,french style storage jar jam,0.39052631578947367
o23186,french style storage jar cafe,0.4172222222222222
o23187,french style storage jar bonbons,0.30736842105263157
o23188,vintage  2 meter folding ruler,1.9140243902439023
o23189,set of 12 fork candles,3.3786075949367094
o23190,bundle of 3 school exercise books,1.788989898989899
o23191,bundle of 3 retro note books,1.8186624203821655
o23192,bundle of 3 alphabet exercise books,1.7787058823529411
o23193,buffalo bill treasure book box,2.786590909090909
o23194,gymkhana treasure book box,2.7385344827586207
o23196,vintage leaf magnetic notepad,1.76575
o23197,sketchbook magnetic shopping list,1.977741935483871
o23198,pantry magnetic  shopping list,1.7786561264822134
o23199,jumbo bag apples,2.515610687022901
o23200,jumbo bag pears,2.38958904109589
o23201,jumbo bag alphabet,2.3679411764705884
o23202,jumbo bag vintage leaf,2.2893577981651374
o23203,jumbo bag vintage doily,2.245111111111111
o23204,charlotte bag apples design,1.1487543252595156
o23205,charlotte bag vintage alphabet,1.107310924369748
o23206,lunch bag apple design,2.0819301470588236
o23207,lunch bag alphabet design,1.9852216748768472
o23208,lunch bag vintage leaf design,1.8729253731343283
o23209,lunch bag vintage doily,1.8282841328413284
o23210,white rocking horse hand painted,1.5129357798165137
o23211,red rocking horse hand painted,1.5467816091954023
o23212,heart wreath decoration with bell,1.4897196261682244
